name,function,category,input,output,interface,license,status,link,organism_scope,skill_level
CelloCad,Automatically designs genetic circuit DNA sequences from high-level logic specifications written in Verilog (a hardware description language),genetic circuit design,"Verilog code (.v), User Constraint File (UCF) defining available genetic gates",DNA sequence layout (SBOL or GenBank format),Web app / CLI / Python library,open source (BSD-2-Clause),actively maintained,https://github.com/CIDARLAB/cello,Primarily E. coli (with modern expansions to mammalian cells and other bacterial hosts),requires domain expertise
iBioSim,"Models, analyzes and dynamically simulates genetic circuits, metabolic networks, and cell-signaling pathways",modeling,"SBML model, SBOL design","Dynamic simulation data, ODE/stochastic plots, abstract system models",GUI (Java desktop app),open source,actively maintained,https://geneticlogiclab.org/ibiosim.github.io/,broad (supports multicellular and spatial modeling),requires domain expertise (Intermediate)
SynBioHub,"A public design repository and registry that allows synthetic biologists to securely store, share, and track genetic parts and circuit designs",genetic circuit design (data repository),"SBOL, GenBank or FASTA files","Standardized SBOL metadata, sequence files, and visual part maps",web app / API,open source,actively maintained,https://synbiohub.org,broad,beginner-friendly
COPASI,"A comprehensive biochemical network simulator that models reaction kinetics using ODEs, stochastic math and steady-state calculations",modeling,"SBML files, biochemical equations, rate parameters",,GUI / CLI / Python library,open source (Artistic License 2.0),actively maintained,http://copasi.org,broad,requires domain expertise
BSim,"An agent-based simulator designed to model the spatial movements, constraints, and behavioral interactions of dense bacterial populations in 3D",modeling,Java configuration scripts defining cell behavior and environmental physical parameters,"3D spatial simulation renderings, cell-tracking vectors, population growth dynamics",GUI / Java library,open source,actively maintained,https://github.com/CellSimulationLabs/bsim,E. coli only (Bacterial colonies),requires domain expertise
Tellurium,"A Python-based environment designed for reproducible, dynamic modeling, simulation, and parameter optimization of biological networks",modeling,"Antimony strings (human-readable modeling text), SBML models, SED-ML experiment instructions","Simulation plots, numerical data arrays, COMBINE archives",Python library / GUI (Spyder IDE bundle),open source,actively maintained,https://github.com/sys-bio/tellurium,broad,requires domain expertise (Intermediate)
RBS Calculator (Salis lab),"Predicts the translation initiation rate of a ribosome binding site sequence, or engineers a custom sequence to match a desired translation rate",sequence design,"Target mRNA sequence, organism translation characteristics, target initiation rate","Optimized DNA/RNA sequence, calculated translation initiation rates",web app / API,free for academics / paid for commercial,actively maintained,https://denovodna.com,prokaryotic (bacterial systems),beginner-friendly
SBOL Visual,A universally accepted standard graphical language that provides structured biological glyphs to visualize genetic circuits consistently,sequence design (visualization standard),N/A (It is a glyph library specification standard ingested by structural drawing utilities).,"Standardized vector graphics (promoters, terminators, barcodes, etc.).",web app / integrated into external tools,open source (Creative Commons Attribution),actively maintained,https://sbolstandard.org,broad,beginner-friendly
Pigeon,"A web and command-line application that quickly translates simple, shorthand text scripts into high-quality, SBOL Visual-compliant genetic circuit diagram",sequence design (visualization),"Plaintext shorthand string instructions (e.g., specifying promoters, coding zones, and color codes).","Genetic circuit image diagrams (SVG, PNG, or PDF formats).",web app / CLI / Python library,open source,actively maintained,https://github.com/CIDARLAB/pigeon,broad,beginner-friendly